sentiment,text,quality,difficulty,prof_name
1,Dr.Z has a thick accent but you will adjust to it quickly. She makes the lectures bearable with jokes and commentary. She writes down all the notes on the slides so it's easy to understand and take notes and she is willing to help any student that comes to her. She's very knowledgeable about the subject and her passion for anatomy comes through.,5.0,5.0,Natalya Zinkevich
1,"She is such a sweet professor! She pretty much wouldn't hurt a fly! Class is only mandatory for clicker questions, other than that you will pretty much teach yourself from the book and online tests. good class.",4.0,1.0,Melissa Birkett
0,"Words cannot describe how terrible this class was, take Mrs. Pickham if you want to have a chance at passing speech.  And if you do for some reason take this class, be ready to hate your life, dont come in 1 minute late, dont fidget while giving your speech and make sure to let her know i hate her guts, thanks.",1.0,5.0,Jennifer M. O'Donnell
1,"Prof McMillen is the best COB 300 teacher in my opinion. Idk why but I want to do well in his class to impress him. DO NOT SLEEP ON THE TESTS, they're pretty hard. But, he tells you what to focus on and the best way to study and it works. Great experience for my only marketing class",4.0,3.0,Robert McMillen
1,One of my favorite teachers at Southern Miss. He gives great lectures and almost everything you need to know is from the lecture. In order to receive an A in the class he says that you have to read. He is very informative and his tests are not too hard since he puts up every study guide by the first day of class.,5.0,3.0,Daniel Capper
1, GET BOOK ONLINE.  Many assignments.,5.0,1.0,David Marlow
0,"Lectures are dry and quite boring honestly. As a required class, you'll have to deal with it. Maybe just don't take it as an 8am class and the lectures would be more enjoyable. He seems like a genuinely good and funny guy. I just don't enjoy his lectures.",2.0,3.0,Gary May
1,"Tough class, but he will give you points for anything, so show your work. Great guy and awesome class. If you think the material is boring, it will make it hard to listen and do well.",5.0,4.0,Timothy Flannery
1,Professor Platz is a good professor. She gives a clear criteria on what is wanted and is pretty lenient on most occasions. If you need a writing course to be fullfilled take it with Jenny Platz,5.0,1.0,Jenny Platz
1,Nice professor. Not really interested in the course but he did a good job teaching it. Exams come more from movie sheets than lectures. if you memorize movie sheets and read powerpoints you should do fine.,4.5,3.0,Orin Gelderloos
1,"Miller is the most amazing and genuine professor that I have ever had. He really cares for his students and just wants to interact with everyone. If you need an English class, definitely take him. You won't regret it!!!!",5.0,1.0,Stephen Miller
1,He's awesome. And really helpful. My only issue was keeping up with all the work. There's a lot of projects. He's a nice teacher though. Fun.,5.0,3.0,Doug Domine
1,An amazing Professor he really takes the time to work with his students and is passionate about his lessons. I highly recommend his class comm 30.,4.0,1.0,Christopher Forsythe
1,Great teacher,5.0,3.0,Kathryn Wood
1,"she is very helpful, and a great teacher, she is always motivated the students to go ahead, she asked you all the time you understand? If you not she take time to give you all the explication  that you don't understand she is great and she have a charisma to teaching she love that she don't wants the students fail class,she is reminded each time.",3.0,1.0,Andrea Schultz
1,He is great teacher but you'll struggle a lot if you haven't taken a piano class highly recommend to take a piano class before this one. Also make a lot of appointments with him if you don't understand something like the values of the notes. Even if its one thing. This class was hard for me since I was in a guitar class before not piano.,4.0,4.0,Peter Knapp
1,Such an easy class! Everything is laid out for you and she gives clear study guides. Easy A and lots of extra credit opportunities. not extremely interesting content and a lot of common sense information but otherwise a great class. No need for the textbook.,4.0,1.0,Tara Stringer Guerriero
1,"Beyond some very dry humor, Professor Davis is great in providing valuable feedback and keeping lectures very straightforward. Exams are based on practice problems, not looking to trick students. Group Projects are assigned throughout the semester. A paper as a final project giving you the freedom to pick your favorite topic.",5.0,3.0,Darwin Davis
0,"Ugh, biochem is hard but there are other professors you can and should take than him. I understand that teaching through zoom is not his thing, but he rushes through his lectures very often. This class is only based on your exam grades and that is something you should look out for. Fail one exam, and you're out from the race of getting an A.",2.0,4.0,David Hoffman
0,Her Teaching ability is very pathetic,1.0,5.0,Darlene Pabis
1,"Morra is extremely passionate about his field and is very enjoyable to have as a teacher. His lectures are clear, detailed and easy to understand. Only two tests, a mid-term and a final, both of which are essays. Puts his powerpoints up online for you to look at whenever. Easy to pass, provided you give your best effort. Definitely recommend.",4.0,2.0,John Morra
1,Fantastic Prof who really cares and likes engaging with students. Wish I didn't have to take the class online.,5.0,3.0,Jaymie Heilman
1,"Took her for chem111 and she is mu favorite chem professor out of the 3 I've taken. Yes it's a tough class but she is easy to approach and explains things better if you ask her too. I would take her again, assuming I pass the class",5.0,2.0,Samantha Katner
1,Hands down the best math teacher I've ever had. I feared Math until I had Alisa's class. she explains things in a way that makes it easy for non math folks to understand. Her tests are hard but she prepares you for them really well. I would recommend her to anyone!,5.0,3.0,Alisa Vanorden
1,"I love Dr. Hartman she is so caring, and helpful. As long as you put forth effort she will help you with whatever you need help with. She is so understanding, and easy to talk to. She likes to talk to her students and check in with her students to make sure they are understanding the assignments and are doing a good job. Very easy.",5.0,1.0,Kathleen Hartman
0,"I withdrew from Ms. Lytle's class because she was very difficult to contact, seemed picky, and assigned a speech outline the first week without giving us any information or examples about how to do it. Perhaps she would be better in person.",2.0,4.0,Erika Lytle
1,She was an amazing French prof. I learned a ton with her and she is extremely nice and caring. Grade is reflective of effort as her tests are very fair and she wants everyone to do well.,5.0,3.0,Monika Edinger
1,Great professor! She works you out at your level and I also enjoyed the individual attention that she gives. She is also a great motivator!,5.0,4.0,Linda Thompson
1,"This class is hard, but its a two-in-one gen-ed knockout, and the content is very stimulating. Unlike most classes, you have to actually participate to pass. Sections are easy and offer extra credit every week. Very funny dude. Not much more I can say.",5.0,3.0,Leslie Looney
0,"He gives the worst grades ever. He lectured on A thing and mark you down for doing literally the exact same thing. He's good I give him that but doesn't allow him to be rude when giving comments. His instructions are unclear and his requirements are just too much. He's asking for too many things, even if you're doing everything asynchronously.",1.0,5.0,Michael Dowding
1,Dr hauck was very clear in lecture and encouraged interactions outside of class in group sessions (even on Sunday afternoons). An A is very very possibly with Dr Hauck if you review notes outside of class before quizzes and exams.,5.0,4.0,Nathanael Hauck
1,Prof. Jackson makes public speaking bearable! Her classes seem like a large family so you are encouraged to speak. She has five speeches but gives amazing feedback for you to improve on each time. The grading is straightforward and she is available to help you outside class. Just keep up with the quizzes and speech outlines and you'll get an A!,5.0,2.0,Michelle Jackson
1,After taking Professor Perez for speech class i'm no longer scared to be in front of a class and present. She's a great teacher that gives great feedback that will strengthen your speeches. As long as you show up every day and get all of the work done you'll be fine. I highly recommend her!!,5.0,4.0,Christina Perez
1,"Great guy.  He makes you work, but you learn a lot.",5.0,4.0,Scott Fredrickson
1,"Not a bad professor.  Like the rater before said, it's just hard sitting through 2 1/2 hours of lecture at night.  Basically an easy A if you go to class and do the papers.  He is full of a lot of information though.  He knows his stuff and has a lot of real life experiences.",4.0,1.0,Mikhail Grachev
1,Really helpful...lots of extra credit and study sessions. Fair...patient...helpful.,4.5,3.0,Bob Odien
1,"He literally gives you every answer to the tests. Grading is just 6 tests and go to 2 orchestra concerts. He's very... eccentric. Talks about political issues a lot, which I think is more interesting than music anyway. I recommend him. Do not get the book, it's a waste. Just buy the online access code.",4.5,1.0,Reimund Koehler
1,"Always show up to classes. There are regular assignments. She offers a lot of reading, but it's all articles. So no textbooks needed. She really makes it clear she wants to be there. Health econ can be a bit dry, but she incorporates a lot of relevant stuff for today. It was a great class",5.0,4.0,Jacki Strenio
1,"friendly and tries hard to entertain the class with pictures, but his notes are very disorganized and doesn't tell you which parts of his version arent in the 'student' version so unless you print them, try to sit with someone who does; relatively easy, nice to have all multiple choice with bonus questions and not cumulative",3.0,3.0,Edward Lai
1,Super clear lectures. Low difficulty but you can definitely learn things! Took his differential equations at Scripps College this semester. Really liked it!,5.0,2.0,Randall Swift
1,"Dr. Gelderloos is a wonderful lecturer and a respectable man. However, I can't recommend his class to people who are trying to maximize their courseload or who are working. He gives an outrageous amount of work, easily several times more than my other upper level classes. His classes are difficult because of this. Have free time? Yes, take him.",4.0,4.0,Orin Gelderloos
0,"1. His slide decks are awful - paragraphs c&p'd, reads directly from, few in-class examples, no excel use, no computer lab classroom 2. Projects were good, but all self-learning, easy grader 3. Final is egregious nonsense. Took full 3h for 30q, and I wasn't alone. Most material not covered, you need to self study book. Take CFA instead.",1.0,4.0,BO Ouyang
1,No Comments,5.0,3.0,Melissa Birch
1,"Amazing professor, will certainly grow your interest of the music industry.  His lectures were incredibly informative and you will feel very fortunate to be in his class because he has so much knowledge to offer and you will absorb more of it than you could ever imagine, if you put in the work. It's a hard class, but well worth it.",5.0,4.0,Paul Young
1,i took Rafferty last fall. She told you what you had to do to pass and was always willing to help in office hours. Physics can be really boring but she made it interesting. She records lecture videos every day and posts them so if you miss class or need to see an example again. The homework is hard but the program walks you through it. Take her,4.5,4.0,Stephanie Rafferty
1,"I took the hybrid class.  He kept everything up to date on D2L and sent e-mail reminders when an assignment was due.  The assignments are easy to get full credit on.  The tests are matching and multiple choice, but he grades on a curve.  Be sure to study the book and the notes for the tests.",5.0,2.0,Albert Bugaj
1,She is very nice. I love her accent!!,5.0,1.0,Regina Blue-Soloman
1,My tailoring class with Ronda has transformed my sewing hobby into a total obsession! The techniques she teaches ranges from practical to total couture. Ronda provides excellent drawings and written material to assist you outside of class (and in the long term when you've forgotten how to use a certain technique). I look forward to every class!,5.0,4.0,Ronda Chaney
1,"Though she came off as tough, she was a great teacher. A lot of people didn't like her because she made us work but it's college it's time to be an adult. All Directions were precise and clear. I was always determined by her toughness and turned in every assignment on time,  never missed class, and got an A.",5.0,1.0,Vann Rogers
1,My boyfriend and I took her class and loved it. She was recommended by a lot of past students. If you study and come to class it's pretty chill. She stays after to help you with anything. Mrs. Garrisi is a cool prof.,5.0,1.0,Sensei Garrissi
1,Inspiring,5.0,3.0,Stephen Esposito
1,Professor Endlich is amazing. You won't regret taking her class. She is accessible and very understanding. Has a few lectures and papers but she is not as strict as other professor. She makes class enjoyable and easy going.,5.0,3.0,Christine Endlich
1,"Butman is a very tough grader however, is very easy once you get the hang of the essays. Learn from mistakes !!!! First 2 essays were an F and a D. He explained mistakes not to make and once corrected i became a B student. Point is, don't let his attitude make you drop he actually does care about his students in his own way",2.5,4.0,Ray Butman
1,Business Law 2.  Took this class Fall 2014 - Peruyera is a lawyer. He lectures each chapter via power point. Goes into Spanglish mode all the time. Funny guy. Easy going. Early releases usual. You will have a presentation and paper for the final. ,5.0,1.0,J Raul Peruyera
0,"Lectures are long, does not explain material well. Does not give clear expectations. Answers emails fast. Book is useless, he provides a free pdf version.",1.0,5.0,German Velasco
1,"Econ 2370 is a challenging class, but Professor Melendez is amazing! I am not good at math, and I had to study a lot for this class. The material is hard, and you for sure have to WORK HARD for your grade, but Melendez is more than willing to meet with students if they are struggling. He was always VERY helpful and understanding & he's so funny!!",5.0,4.0,Joel Melendez
1,"Completely disagree with other comments.  Great teacher with true concern for the students.  A study guide was given for each exam and the tests came straight from the guide.  The powerpoints were posted on her website prior to lectures.  Many animations and other aids to help in learning were provided.  She was tough, but very fair and caring.",5.0,4.0,Holley H. Langille
1,"Prof Platz is young and she relates to her students in a way where she realizes that you do not want to have a lot of work. She is really understanding and helpful if you talk to her one on one. The course material and homework is easy, just annoying. She also is not the easiest grader in the world but if you put in effort then you will get an A",3.5,2.0,Jenny Platz
1,"Professor Pangallozzi was an awesome teacher. She is extremely knowledgeable and great at her delivery. The COVID pandemic forced the class online, so things felt a little rocky to start, but she had it pretty well figured out in a few weeks. Quizzes and tests were all online and open book, so as long as you keep up with the reading it an easy A.",5.0,2.0,Laura Pangallozzi
1,"Had to attend lecture in order to be there for her pop quizzes. All notes were written on the board but she posted them on canvas so if you had to miss you could still get them. Tests were easy as they were verbatim from the quizzes and in class assignments. Also there is extra credit, even though you most likely don't need it. EASY A!!",4.0,2.0,Nicola Grissom
1,"Professors dont matter that much with organic chem II. Good or bad the class is still gonna be one of the hardest youve ever taken. Accept that. But MS is one of the best professors if not. Always has a hilarious story, makes lecture fun. Material is hard, exams are fair and professor is amazing. Take MS above all other orgo professors.",5.0,5.0,M. Montague-Smith
1,"Great professor but this class involves little more work than average. You have one paper that is reviewed by people in your class, and you are responsible for making either a Ted Ed like video, Ted talk, or podcast. You are also responsible for reviewing other classmates papers. Not hard assignments by any means but take some time. You also have a test that you will take 3 different times, and it's the same test every time. He's a little unorganized and changes the schedule as you go. Overall though very unique way of teaching, great teacher/person, and I would recommend this class. It's easy assignments and he' an easy grader but will take some time/effort so be prepared.",4.0,2.0,J. Alex Grizzell
1,"Helpful, bit quirky humor.  Has well defined powerpoint presentations for class.  Overall a great professor for intro psych.",4.5,4.0,Albert Bugaj
1,He is pretty straight forward professor online. Class was pretty easy but make sure you study for the mid-term and final as they are most of the points for the class. Would recommend him to other classmates.,4.5,1.0,Jerry Lulejian
1,"Dr. Kosnik is lovely. He is super passionate about music, and it shows in his lectures. He keeps his lectures short and engaging. He is by far my favorite professor.",5.0,1.0,James Kosnik
0,Get quizzes often (worth around 10% of final grade). He has an accent which makes it difficult to comprehend what's being taught.  If you are new to chemistry then do not take this class. He is not straight forward and he can be confusing.   Most of the learning will be done outside of class through homework!,2.5,3.0,Guatam Dhar
0,"This guy is a joke!!! Over half of the class is going to get a D or lower for their final grade and he thinks thats a good thing....will never give a student an A its one of his policies, test are impossible and admits to making them that way on purpose...worst part is he is the only teacher that teaches this class!",1.0,5.0,Danny Ervin
0,"She's not clear in grading. Seems to take points off for no logical reason, even if you have fulfilled the rubric requirements completely. Takes points off during assignments that are based on opinion... Very critical - but doesn't really give any useful feedback. No way to please her. Avoid her if you want to enjoy the subject and not resent it.",1.0,5.0,Elizabeth Ferns
0,Literally the worse teacher I have taken within my two years of being at NCC.,1.0,4.0,Mary Mathis
1,She is by far one of my favorite teachers that  i have ever had. She is so worldly and intelligent and loves to share her knowledge. She is Russian and has a russian accent but that is all it is she speaks perfect english and i would assume english is her second language and she does a great job. I just love her class so much. Def recommend her.,5.0,4.0,Maria Cochran
1,Love Dr. Chalk!! Great class that is always interesting and sparks class discussions. Can't wait to take another class with her!,5.0,2.0,Bridget Chalk
1,One of the best professors I've had. Quite understanding when it comes to assignment . Have to experience this professor for yourself. Don't listen to other students that spread false rumors about him. Once you enter the classroom you'll realize that those individuals were the problem. He provides additional teaching aids to students.,5.0,1.0,Christopher Wayne Purser
0,"Too much reading, I do not learn my reading 30 pages of information and then taking 4 different tests on it. I will NEVER take this class again. I just had a mental breakdown over this class and I'm over it.",1.0,5.0,Clovis Stacey
1,Syllabus is very clear on what is due and when. He lists what he is grading you on in each assignment. Happy to answer any questions you have. Organized and straight forward. This class was very basic and easy to pass. Just show up and do the homework on time.,4.0,1.0,Rod Kendall
1,"I liked taking his class. He is a very good professor, very friendly and never behaves rude. There were a lot of class activities, online bonus assignments and without the attendance you cannot score an A.",5.0,4.0,Scott Campbell
1,Professor Calkins is an amazing ENC professor. Wanted to take her for 1102 but couldn't get a spot unfortunately. She really cares about her students growth as writers and really helps you when you have questions about your papers. If you care about your grade she will make sure you get the best grade possible.,5.0,3.0,Vanessa Calkins
1,Such a sweet amazing professor. I truly enjoyed this class she really cares about each and every single one of her students. Lectures are great she really knows how to teach!!! Love her!,5.0,2.0,Andress Walker
0,While I won''t deny that I think my writing improved from taking this course I would never recommend a Nelson class to anyone.  He''s very pretentious and he addresses his classes with such an air of superiority as if we are simply lucky that he''s letting us in on his insights about literature and the English language.  I would avoid at all costs,2.5,5.0,Randy Nelson
1,"Easy class! A lot of homework assignments every week: mini short essays, social media, quizzes, chapter homework, and class participation assignments. There's a mid-term and final, and one major essay that requires to do presentation on it. Teacher is really nice and grades easily. Boring lectures!!",5.0,2.0,Chelsi Johnston
0,"Has a very high opinion of himself, likes to read out his own stories and talks about his life A LOT. There's never a clear definition of what he wants as a paper, and he's a tough grader. I was bored all the time.",2.5,4.0,Randy Nelson
1,"She's very sweet and knowledgable on all the topics. Sometimes she is a little disorganized in her lectures, but as long as you skim through the textbook and study the study guide before exams, you can get an A! In 230 there were 4 exams, 1 group presentation, & 5 quizzes. Homework almost every week, but it was just the definitions from the chapter",4.0,3.0,Glenora Nelson
1,"Professor Bronie is an amazing professor! She does give a lot of homework, but its really to prepare you. Before every exam she gives out study guides that are similar to the ones on the exam! She genuinely really cares about each student, and she wants everyone to pass her class. Definitely would recommend if you struggle with math.",4.0,4.0,Barbara Bronie
1,An easy A. I did learn a lot and he is sometimes hard to understand. Overall a great class to take,4.0,1.0,Mikhail Grachev
1,"Ms Mahon is the most amazing professor you could ever hope to get! She is genuine, and works to make sure everyone is on the same page. If anyone came to her with an issue or suggestion, she worked with them, never shut anyone down or had an attitude. If you can get in her class you need to take it! She changed my perspective on education. The BEST",5.0,4.0,Kirsten Mahon
1,"I was hesitant to take her class because of the poor reviews, but a friend of mine had taken the class prior and encouraged me to take it with her. She became my favorite professor! I loved her class and the discussions we had as a group. She is so funny and has so many stories from her time abroad. I definitely recommend taking her!!",5.0,3.0,Diane Wolf
1,This class pretty much followed the book exactly. It helped you understand the concepts of programming but the book basically tells you exactly what to do. The assignments are grouped into 3 deadlines so you have to make sure you can keep yourself motivated. He was amazing at returning grades quickly. I always got mine back within 24 hours.,4.0,2.0,Robert Scherbaum
1,Arguably one of my favorite professors! Participation does count towards your grade so make sure you're in class. His exams are really easy if you study the material he gives you as well as the textbook. He made ANT 2750 such a fun and exciting class. If you need to take this class- DO IT WITH HIM!!,5.0,1.0,Lonn Monroe
1,Expect to spend many hours on homework. Type of Professor to choose the hardest questions from the homework to put on the exams so be prepared. A few subjects here and there that are'nt covered in the book which is a bit annoying but overall he's a decent Professor and you will learn A LOT in this class if you put in the work. Lenient grader!,3.0,4.0,Benny Davidovitch
1,what an odd man. The class is easy. 4 5-page papers due throughout the semester. Every class was about 1.5 out of the 2.5 hrs its supposed to be. He also makes food for class.,4.0,1.0,Martin Nesvig
1,"My favorite professor ever! his class is never boring, he knows his stuff, and he's considerate towards his students. If steve martin was an agronomist this would be him. I can't tell you enough how much I love being around this guy.",5.0,3.0,Lee Burras
1,"Nice old guy, really smart. Unfortunately, he can't teach. At all.  He is very helpful on his projects. If you go to him for help don't be surprised if he basically finished it for you. He also might not help you at all (rarity, but happens). If you want a grade, take this guy. If you want to learn, avoid at all costs.",3.0,3.0,Jon Squire
1,He doesnt have a good online class system.,3.0,2.0,Lawrence Lawson
