sentiment,text,quality,difficulty,prof_name
0,"She seems like a smart professor but just cant convey her thoughts across. I try so hard to understand but the language barrier is tough. She tries her best to make sure we understand but doesn't really help much, rather confuses more! tests are very ""unique"" as well!",1.5,3.0,Wei Xing
1,"I took 3d Design with him. A genuine guy that loves what he does. Just don't take this class expecting an easy A. His projects make you think analytically and critically, and when it comes time for his infamous critiques, be prepared for criticism. He gives plenty of class time to develop your ideas and is always ready to help if you need him.",5.0,3.0,Benjamin Bellas
1,"I took her for Writing for PR. very sweet, wants students to do well.  very approachable and friendly. class was a lot of work at first. Multiple assignments, and current event and GSP quizzes every class. quizzes were hard so later on she started letting us use the articles. She goes with the flow, but her expectations can be unclear at times.",3.5,4.0,Olga Wilson
1,"Good teacher, she is knowledgeable, professional, approachable  and kind in her words to students. Take her class you will be well prepared for your life's journey. One of the best at Humber College.",4.0,3.0,Shauna Pemberton
1,"Christina is a funny and wonderful person, dont be intimidated by the bad reviews. Christina is very friendly and the classroom environment is relaxed. Due dates for assignments change a lot based on how she thinks how far everyone is. If u r a visual learner it might be harder for u b/c she doesn't show examples of upcoming projects so TAKE NOTES",5.0,4.0,Christina Gregor
1,Very easy and straightforward instructor. You can show up and pass. She has a lot of in class writings but if you miss those she has so much extra credit it is impossible not to pass the class. Textbook online. Weekly journals. EASY Final project. Class was boring though. I just needed the WI credit. Recommend her to anyone needing an easy class.,3.0,1.0,Kathy Backus
1,Class was easy and good introduction class to geography. Her lectures had some interesting things that arent found in the textbook and overall the class was easy and she was very understanding when it came to distant learning.,5.0,2.0,Laura Pangallozzi
0,EXTREMELY DIFFICULT. Rude and unprofessional. If you don't already basically have a masters degree in physics he is going to make you feel stupid. Doesn't care about his students or their comprehension of the material.,1.0,5.0,Phillip Bannow
1,"I think she was my favorite instructor this semester. She provides examples of each dysfluency during lecture, and she makes it VERY interesting. Her first test is probably the most difficult out of all of them, and it isn't even that hard. She definitely wants to see you succeed, and helps you as much as she possibly can!",5.0,1.0,Ericka Olsen
1,"Lazo- Cividanes is a very well informed professor that delight us with his lectures, specially in the Latin American context where I can qualified him as an expert. What I like about him is the way he has help me in the development of my research paper, a paper I have been working since the start of the semester.",5.0,3.0,Jorge Cividanes
1,"Clearly a very intelligent and capable professor, but he expects a lot. 6 week summer course and there were 3 novels and textbook reading, plus 4 discussion assignments, lots of audio lectures, an essay, reading quiz, and 2 writing heavy tests. Really brutal for a lower division course. If you work a lot, this is even more of a struggle.",3.0,4.0,David Sheridan
1,I never write reviews but THIS MAN IS ACTUALLY AN ANGEL. I have never in my life loved a professor as much as Kole Camaj. Hes a gift from God and truly makes me excited for class. I would cut off all my limbs to take this professor again because he is that incredible. He is my favorite professor ive ever had in my life and I would die for this man,5.0,1.0,Kole Camaj
1,"Mr. November gave awesome feedback (but was more vague on the major assignment gradings.) Group workshops were helpful bc you get feedback from other people. HW instructions were sometimes confusing, but for the most part, the class was easy. It's creative writing, so you can't be graded on your art/creativity. Textbook needed, not many e.c..",5.0,2.0,Greg November
1,"Espo is one of my favorite teachers I've ever had, at first he seemed terrifying, but he's truly a funny and nice guy. His class has taught me a lot and we always have meaningful discussions. He's very passionate about what he teaches. Assigns 1 paper a week but they aren't too hard and are usually 1-2 pages. Really improved my writing. ",4.0,3.0,Stephen Esposito
0,This was by far the hardest class I have taken. All of his work is close together. The good thing is he realizes that and works with you on the time frame. Be prepared to STUDY!!! He does not allow enough time for quizzes and exams and they are extremely difficult!,2.5,4.0,Christopher Wayne Purser
0,"I don't like thw fact that he uses a website through a website for the class just stick to one. The subscription for the second website is not free and students must pay for it on their own. I have not struggled to figure out what was going on using the canvas website until this class, every other class was clear and straight forward.",2.0,3.0,Peter Knapp
1,great professor. tests aren't easy but you'll learn a lot from the class,5.0,4.0,Jill Miller
1,"I took his online class and it was great. I recommend listening to his lectures, writing notes, and memorizing pictures...that's all and you should get an easy A/B. I will warn you that his lectures are boring, especially since I have a short attention span, but don't worry..you can always fast forward to the important parts but dont do it too much",5.0,1.0,Alton Jenkins
1,"Very good prof.  Not an easy class, nor should it be; must think very critically and express it in your writing.  I worked hard and it paid off.  I'd recommend her.",4.0,5.0,Paula Wisotzki
1,"New, but willing to learn.  Enthusiastic, and approachable.",4.0,4.0,Jill Miller
0,This class sucks. don't take it. you will regret it.,1.0,4.0,Dan Clawson
0,"All I can say about Professor Thompson is lazy, save yourself time energy and aggravation and take a different class.",1.0,3.0,Andrew Thompson
1,Absolutely brilliant educator. She was very simple to understand.,5.0,5.0,Janice Crowley
0,"Was not very helpful, made me not enjoy sign language as I enjoyed it very much for 1010. She will call people out in front of the class and has a very short temper and extremely inpatient. Not the best teacher for trying to learn a new language, as she expects you to know almost every sign there is.",1.0,4.0,Celia Young
0,This class is so hard. I know its online but you really have to teach yourself EVERYTHING. The weekly homeworks have nothing to do with weekly tests and either have anything to do with the midterms. She curves the midterms. She uses an app called Piazza for extra credit where you can ask your classmates questions,2.0,4.0,Laetitia Placido
1,"Thad is probably the best teacher ive ever had. He makes hard concepts relatable to things in your own life which made bio 21 an extremely beneficial and pleasant experience. Nicest teacher ive ever had, all around just a genuine guy. would definitely recommend this professor!",5.0,5.0,Thad Winzenz
0,"I am learning absolutely nothing. He is rude, inconsiderate, and heartless. Luckily he means absolutely nothing in the real world of show business. If you have him just know that.",1.0,5.0,Randolph Pearson
1,"Most of us were intimidated on the first day until we got to know her. This instructor was amazing, you had to work for your grade but you learned a lot. Feedback was very helpful.",5.0,5.0,Christina McClung
1,"Wonderful to work with. Learning math through Wildman is attainable. He's an excellent teacher with solid communication skills, passionate, and has a natural talent for teaching math. He cares about student success in his class and that helps engage students.I had no math skills prior to taking his classes. Thank you!",5.0,3.0,Peter Wildman
1,"McKenna is by far my favorite professor. He wants his students to know about the real world and his lectures are extremely interesting. Do the papers, watch the videos, and study his review and you'll get an A.",5.0,1.0,Brian McKenna
1,"Among the best profs of my undergrad years.  Material is presented very clearly.  Professional and respectful of all viewpoints.  A LOT of reading. Class is fast-paced, relevant, interesting.  Accommodating and VERY knowledgeable.",5.0,3.0,Erica Prussing
1,"Great teacher, very helpful, and isn't too strict on enforcing due dates. He explains everything really well and will take the time to help you out during class, but you gotta be willing to put forth at least a little effort.",4.5,1.0,Gary May
1,"Dr. Zbeida is a very good professor. She is caring and generous in her grading scale. There is alot of reading and writing essays, but then again, this is an English Comp class. It's to be expected. I would definitely recommend this professor. She is funny,lighthearted and accessible outside of class. Very approachable.",5.0,4.0,Jessica Zbeida
1,I love Dr. Nikkel! He is super enthusiastic and has interesting lectures. The homework is an easy two questions per week. He reviews for the tests quite thoroughly so if you go to class on the review day you should be good for the test.,4.5,2.0,David Nikkel
0,she's the worse,1.0,2.0,Roxanne Hamilton
1,He doesn't give you a review for any test or the final. If you ask questions he makes you feel silly for asking them. He uses the old book and not the one the you are told to buy. Even if you take good notes from the book you could be studying something not on the quizzes/test. and still fail them. He is a nice guy and can be funny at times.,3.0,3.0,Bradley McEntire
1,"Mrs Miller is fantastic. You know exactly what is expected of you at any moment in time. Communication on a one to one basis is a bit slower, but she always gets back to you. She shows interest in you as a person too and encouraged us to share weekend or break stories on Blackboard. Really glad I took her class",5.0,1.0,Danielle Miller
1,"Showing up to each & every class is very helpful and he is great at responding to your questions when you are confused whether it is in person or online. ( Especially during quarantine). He is very thorough when it comes to his syllabus, whats going to be expected and what is going to be on the test & exam! So glad I had him as my stats professor!",5.0,4.0,Lane McConnell
0,"Do the homework on time and you can assure that you will pass. I passed this class because of that, and on prior knowledge of physics from high school. I only missed one class and learned almost nothing from him. Tests are nothing like the homework whatsoever. He gets frustrated when students don't understand a concept he thinks is simple.",1.0,4.0,Phillip Bannow
0,This was an easy A class but I didn't learn anything from this professor. I took A&P which is the only reason I knew a lot of the information. Also the directions and the syllabus were very confusing to follow. She would become irritated quickly when asked questions by students. Easy GPA booster.,1.0,1.0,Tara McCormick
1,"I love Quinlan! He's so awesome and fun and his stories really help you understand what he is teaching! He is very funny and he gives out a lot of extra credit points on tests if you speak up in class. You are rewarded for being a well rounded student in his class. Talk to him about sports, he'll love you.",5.0,3.0,William Quinlan
1,"Dr.Smith is a great. This is one of the easiest classes. No midterm not final. Just write a few papers, submit them. He is very helpful in helping you with your papers, and learning your mistakes, very friendly. Hope to take more classes with him. He's the campus newspaper advisor.",5.0,1.0,Lewis Smith
1,It's once a week and it's a steal in terms of class requirements. You will do great as long as you study/memorize the study guide he gives you at the end of each unit (the week before the exam). Take time for that and you will be absolutely fine.,4.0,2.0,Jonathan Wallace
0,"Not my cup of tea. Assigned a ton of reading, expected really high level in class essays. I say stay away from her.",2.0,3.0,Leigh-Ann Wheeler
1,"Omgg I love my professor soo much, She is the best teacher for math, she explain so well. I just to hate math, but now I enjoy so much math thanks to her.",5.0,2.0,Alice Lee
1,"Ms. Johansen is very fair and professional. She prepares you for exams that are based on both the lectures and book material. If you come to class, do the work and study you'll do fine. She's available for questions and help in class, or email her your papers and she'll help you! She's very smart and wants you to succeed in her class.  Take her!",5.0,3.0,Leanor Johansen
1,"Excellent prof.  He does NOT pick on people.  Do your work and you have nothing to worry about.  He is easy to talk to and really gets you thinking.  I can honestly say that I learned alot from him.  He's always willing to help and has a great sense of humor.  And yes, he's very hot!",5.0,4.0,Richard Lane
0,"Online Math 90 Class.  Class runs itself.  If you have a question, don't expect an answer until after the assignment in question.  Don't expect your tests graded in a timely manner either, he'll blame the school for not delivering them to him.",2.5,1.0,Steve Narin
1,"Tami is super friendly and helpful! She makes herself easily accessible outside of class to answer or explain any questions we might have. She has lots of long lectures, followed by practice/group work time, so you get lots of hands on. But the homework is definitely a lot of work!",4.0,3.0,Tami Dashley
1,"He's definitely an awesome Professor! He's always ready to help, both in and outside class. His class is super organized and the grading criteria is very clear. Go to class because his lectures are useful. Use homework solutions he printed out to review for exams.",5.0,3.0,Tom Witelski
1,"Brent's class is easy as long as you do the work, but if you really want to excel just ask him for advice and he'll make you the best.",5.0,2.0,Brent Wiley
0,"I had to learn everything from Khan Academy. I have no doubt he might be good in-person but online his videos are 10 minutes for what is supposed to be an hour lecture. He only does ONE problem per section, and his mind seems very scattered. I am not LEARNING from him. I feel like I'm being set up for failure for the future in his online course.",1.0,3.0,Nicholas Eisenberg
1,THANKS,4.5,3.0,Regina Blue-Soloman
1,"He's one of those professors that you resent during the semester because of the amount of reading and how hard his tests are, but I have to say I came away from his class with a ton of knowledge. Makes you work for it, but it's probably the class I've got most out of in college.",4.0,4.0,Daniel Lipson
1,"Professor Thomas-Reid is by far one of my favorite professors. He makes sure to make a safe space for everyone. He is one of the most caring and genuine professors I have ever had. He truly cares about his students and is very understanding and approachable. His class is based a lot on lectures, and discussions but you will never get bored. 10/10",5.0,1.0,Matthew Thomas-Reid
1,Grades are based on tests but if you study you will pass. Professor Bronie makes sure you understand and is tough sometimes but is caring.,4.0,4.0,Barbara Bronie
1,"if you are a science major i highly recommend this prof, you will learn the material if you apply yourself, chemistry is not a class you cheat, you either learn it or not and avila puts you in position to succeed, do all the work requested and you will get a b, slack off and be lazy you won't do well, put the time in and an A is very attainable",5.0,4.0,Ludivina Avila
1,"If youre good at memorizing, take him. His tests are solely based off few things from the horribly boring book he assigns and random things he says in lecture. Pay attention and youll make an easy A. He truly wants you to succeed in life. Hes very awkward at times which is funny. Too bad you have to show up since his class is easy.",3.0,4.0,David Veve
1,"Tough subject with good professor. Moves fast but provides slides,Practice exams VERY similar to exams and lets you make one index card. This class is nothing but a bunch a formulas and knowing how to use them n some excel, He knows his stuff REALLY well, You are getting real knowledge not textbook stuff. Take him but get ready to study n work hard",4.0,4.0,Joel Melendez
1,Lab exercises are given each week as meetings are set for once a week. Online classes were a waste of time as she spent 20 minutes to barely explain and put us into breakout rooms. Constantly bringing us in and out. Talks a lot about other things and will speed through topics. Will probably yell and be energetic. Teacher is okay and understanding.,3.0,3.0,Erica Sharar
1,He is a very kind and thoughtful teacher. He is so knowledgeable from graphic design to interaction design. I'm looking forward to take more classes with him.,5.0,4.0,Bert Emerson
1,Shauna is honestly amazing!!!,5.0,4.0,Shauna Pemberton
1,"Obviously those who don't want to do the work will give the worst reviews. Those who say she has an accent are plain ridiculous. She is very organized, gives wonderful lectures and has emailed back in a few minutes. So not sure what the complaints are about! Tough class, so do your WORK!!!!! She made an online class WORK! Great prof.",4.0,4.0,Roopa Prasad
0,"She makes this class really hard, but if you ask for help outside of class it will help. She moves too quickly through material, her accent makes her hard to understand, and she doesn't answer questions in class well. There are graded clicker questions each class. There is a semester long group project. Definitely suggest going to office hours.",2.0,4.0,Trista Wang
1,The professor is basically a live textbook (in a good way). If you don't like watching someone solve math problems though you can just read the textbook. Only part that really sucked was the TA. He's super harsh and mis-graded my homework several times.,5.0,3.0,Arie Israel
0,"Do not take Mr. Weiner's class. Do not. He doesn't answer questions, there are a lot of assignments. He is stubborn in his opinion. He can be very rude. The class is like a high-level sociology class instead of an intro class. There is so much reading and if you don't understand it he patronizes you. Just find some other professor, please.",1.0,4.0,David Weiner
1,"TAKE HIS CLASS! He is so cool. He will make the class fun. Gives review questions based on the book chapters and the same exact ones are on the exams. Exams are super easy! He does make you do essays but make sure you follow his directions on them. Not hard, if anything they are super easy because provides enough information in class to write essay",5.0,1.0,Joe Alvarez
1,"Great humor. Always gives you honest advice if you need it. She's a motivating person and works hard with her students as opposed to just watching them. Honestly, I love her.",5.0,2.0,Linda Thompson
1,"She enjoys teaching and makes class fun. I learned a lot from this class and I am grateful to her for it. She can be a harsh grader, but you can't learn from slacking off the whole time.",5.0,2.0,Tarah Foster
0,"I really wanted to enjoy this class because of the subject, but Professor Sewell makes it hard to. I've taken more academically rigorous classes, yet this professor has the harshest standards of grading I've witnessed so far. She does give instructions, but even when you try to adhere to her standards, it's not good enough. Regret signing up.",2.0,4.0,Lauren Sewell
1,"Prof Infante is such a nice and genuinely caring person. Despite the fact that I never understood a single reading and could probably, at the end of the semester, not tell you what this class is about I would take the course again in a heartbeat. It is rare you find a professor as nice and class discussion was always fun even when it was confusing!",5.0,2.0,Ignacio Infante
1,"Michael Elliot is an awesome professor. Not only does he nail down on information that you need, but he also has plenty of useful advice to go with it. His group projects may seem scary at first but he's there to offer guidance towards achieving your project's goal. All of the effort he puts into the class is for your benefit, so take advantage!",5.0,2.0,Michael Elliott
1,I personally liked this class. She always introduced new material which kept the class interesting. Lots of assignments but not hard. Is very strict on attendance.,4.0,3.0,Jennifer Sias
1,"Prof. Infante is super enthusiastic, kind, and reasonable. World Lit challenged my thinking but was never too stressful, and he both gave great lectures and made sure the discussions went somewhere. You can tell that he loves the subject matter, and he is really willing to help with papers. If you put in effort, your worldview will expand a lot!",5.0,3.0,Ignacio Infante
1,"Awesome teacher!! Grades are just 4 essays and attendance. I used to no like writing but after I took this class, I started to really like writing. Definitely take this class. I loved it so much. Dr. Hartman is amazing too. Very nice, caring, personable, and helpful.",5.0,3.0,Kathleen Hartman
1,"The class is mostly lectures, but she does a good job keeping it interesting. It is fast-paced and difficult to keep up with sometimes. There are 4 exams, 4 books, and a few other assignments. Don't buy the textbook, just go to class. Never used the textbook and was fine. Definitely show up to class or else the material will be hard to understand",5.0,3.0,Joanne Goldmanm
1,"Lisa is one of Coe's most amazing professors!  She makes the topics fun, intersting, and learnable.  Not too hard, not too easy, really funny, can't say enough about her!  Take her class!",5.0,2.0,Lisa Barnett
1,"Class lectures aren't that interesting. Lots and lots of reading for every single class period. Only one large paper to write, but smaller writing assignments throughout the semester and in class writing.",3.0,4.0,Aziza Bayou
0,"He likes to have a lot of classroom participation and is very energetic, but does it in a wrong way. Tries to take feedback from students but lots of times gets lost in what the feedback actually is. Picks on people a lot, and attendance is taken every class, so if you sometimes skip, might not be the best choice.",2.0,4.0,Shawn Richards
1,SHE IS THE BEST!!!!! she is very great!!!! when i was about to fail she told me what all i can do in her class to get my Grads up and inspired me to do BETTER in my studies! Great teacher hands down!!,5.0,1.0,Victoria Dixon
1,"She is a nice lady, but she is a harsh grader. You really have to earn your grade. I had to use outside resources a lot to come out with an A. It's hard, but it's definitely possible.",3.0,3.0,Sherrill Linder
1,"Absolutely Hysterical, Really do your readings though! He likes to mess with your head on tests. watch family guy he loves it! And for the love of anything don't say good things about UCLA he hates them",4.5,2.0,Mike McKenzie
1,"Brett took a dry course, Accounting, and made it bearable. I enjoyed his lectures and his humour. I highly recommend him for anyone who is required to take accounting and not overly interested in it.",4.0,3.0,Brett Goldsmith
1,"Jeri is amazing! She made me feel at home as a transfer student and helped me find a direction I wanted to take my art! I wish I had more classes with her, because she is one of the only one in the art department who will actually sit down with you and help you through things. Super fun lady as well! She has a sheep farm and a puppy she loves.",5.0,1.0,Jeri Robinson-Lawrence
1,"Great Prof, not my highest mark but she keeps it interesting. Very serious marker - no easy marks from her. She is however extremely accommodating and pushes students to achieve their fitness goals. Oh, and Also pretty easy to spend an hour a week looking at!",5.0,4.0,Sue Rochester
1,Go to class and pay attention and you will be fine. He is straight forward and will tell you what to study for each test and the final exam. His notes are very good and labs are not that bad. MUST TAKE FOR ME3500,5.0,2.0,Jonathan Maisonneuve
0,Horrible class structure and the professor is a bit crazy. I dropped this class because I had a bad feeling about him. He has lots of assignments and he is ridiculous about how he requires you to submit them. The class has a horrible structure and he treats the students like it is a second grade class.,1.0,4.0,Michael Zank
0,"The class consists of heavy reading work, weekly reflections, and an overarching group project that is based on the idea of creating a well rounded lesson plan. Note that this is a foundations course, so it was my first ever lesson plan. We were verbally torn apart in front of our class for 10 minutes. Still got an A but it was not a pleasant time.",1.0,4.0,Alina Reznitskaya
1,"If you think logically and have a good math/proof based background, Dr. Buhler's explanations will make a lot of sense. Otherwise, you may have trouble understanding him. However, he is helpful if you have questions, and is willing to listen to student feedback.",4.5,3.0,Jeremy Buhler
1,"ONLINE CIT 120. He was helpful & organized. This online class was VERY easy to understand. I would totally recommend him. Also, my BF took him too & my BF emailed him asking if he would still get a ?B? in the class if he didn?t do the last project & Mr. S said that he would SPOT HIM 5.5 points so he?d get an ?A? if he did the project. AMAZING.",5.0,1.0,Robert Scherbaum
